{
  "platform": "kvm",
  "netropy_image": "/home/sushanthbuds/netropy-lab/images/netropy-ve.qcow2",
  "ubuntu_lts_version": "24.04",
  "naming_prefix": "netropy-lab",
  "ssh_public_key_file": "~/.ssh/id_ed25519.pub",
  "subnets": {
    "mgmt": { "cidr": "192.168.100.0/24" },
    "data1": { "cidr": "192.168.101.0/24" },
    "data2": { "cidr": "192.168.102.0/24" }
  },
  "instances": {
    "netropy": {
      "mgmt_ip": "192.168.100.10",
      "data1_ip": "192.168.101.10",
      "data2_ip": "192.168.102.10"
    },
    "linux1": {
      "mgmt_ip": "192.168.100.21",
      "data_ip": "192.168.101.21"
    },
    "linux2": {
      "mgmt_ip": "192.168.100.22",
      "data_ip": "192.168.102.22"
    }
  },
  "options": {
    "passthrough_data_ports": false,
    "vcpu": 2,
    "memory_mb": 2048,
    "provision_netropy": false
  },
  "credentials": {
    "note": "KVM uses local libvirt socket; no remote credentials required."
  }
}
